{
  "candidate_frame_sha256": "e2b24d9a16989a868cffbca7e8814f72c2c9e48c509cc404891341a21888748f",
  "horizons_days": [
    30,
    90,
    180,
    365
  ],
  "input_inventory_sha256s": {
    "cohort": "c981f23ab5b89a8d579dc345aa326ed89b8a4fc5885272adf2b59241c41e5538",
    "git": "c8ccf46663d9b0e53586897270c85f45ad3cbd9fb41967cac8bea5fdb01def65",
    "lineage": "7b521674ad4a174504768b96a94352d25af7a836bd16528fb47bdb777b6ef784",
    "sourcegraph_index": "b6b18eed39693b4b7fc9c9bd3c814f13daaa86e37053b4c209d845ec8aee4de8"
  },
  "longitudinal_batch_plan_sha256": "ebf4b7701b4df51258e7b9e9a841b32fb6536091fd43346e0f4570073b6631bb",
  "longitudinal_batch_plan_version": 3,
  "outcomes_consulted": false,
  "repository_count": 96,
  "units": [
    {
      "introduction_shard": {
        "path": "/mnt/agent-code-authorship/survival-study/cohort-shards-v1/0x4d31__galah.jsonl",
        "sha256": "1f1689b98c6925b46d39789a1c5820a8e75ff2243b61eec919fba315f0709e5a"
      },
      "probe_manifest_path": "/mnt/agent-code-authorship/survival-study/sourcegraph-longitudinal-v3/probes/0x4d31__galah.json",
      "probe_status": "pending_sourcegraph",
      "probe_unit_id": "ab06900fc744e69ae4cab71d04885d8861619c148f883ef328de936ef73fd78c",
      "repository": {
        "bundle_sha256": "7b5c62d34aa322dd7988a1ce4b446c89d0111a78be5ce26f29fcbc9c8c3ca514",
        "cache_path": "/mnt/agent-code-authorship/survival-study/repositories/0x4d31__galah",
        "canonical_repository_id": "0x4d31/galah",
        "cutoff_commit": "8f77b85e892731cf1402963d8121c79fef0e59c7",
        "cutoff_tree": "46ef771f0f0bac3229632a61353234343b92d2aa",
        "sourcegraph_name": "github.com/sg-evals/0x4d31-galah"
      },
      "transition_shard": {
        "path": "/mnt/agent-code-authorship/survival-study/lineage-v1/transitions/0x4d31__galah.jsonl",
        "sha256": "fe663d5645da011fada332cf9568bcea1c4d25032f30ffb6919733071f102691"
      }
    },
    {
      "introduction_shard": {
        "path": "/mnt/agent-code-authorship/survival-study/cohort-shards-v1/0xfurai__peekaping.jsonl",
        "sha256": "e68208477f31267bd0f7c28148695685cfc771578614dff851bfccaa05f11a12"
      },
      "probe_manifest_path": "/mnt/agent-code-authorship/survival-study/sourcegraph-longitudinal-v3/probes/0xfurai__peekaping.json",
      "probe_status": "pending_sourcegraph",
      "probe_unit_id": "2878f2054ec043c554f5a6707359ea02677c3887b79796a0f34ca8df53394ff0",
      "repository": {
        "bundle_sha256": "27ac85937a50096ff67b0f881adc2e337f8367ad1e8f5ffd760fe7096c4f9a97",
        "cache_path": "/mnt/agent-code-authorship/survival-study/repositories/0xfurai__peekaping",
        "canonical_repository_id": "0xfurai/peekaping",
        "cutoff_commit": "742a60d94fdaacc977c09444b651f7cf1c1aab9e",
        "cutoff_tree": "027aac0deb908423de7ba2dbc23bbacb63176a54",
        "sourcegraph_name": "github.com/sg-evals/0xfurai-peekaping"
      },
      "transition_shard": {
        "path": "/mnt/agent-code-authorship/survival-study/lineage-v1/transitions/0xfurai__peekaping.jsonl",
        "sha256": "8574d5531b3bef18f616c000a70e244001e7b5513cd4e31214e919e680106bf9"
      }
    },
    {
      "introduction_shard": {
        "path": "/mnt/agent-code-authorship/survival-study/cohort-shards-v1/a16z__halmos.jsonl",
        "sha256": "d8d68db2d5dd9656f420c48eb125433d03880cdfe220384dd6f358cc1fba0a15"
      },
      "probe_manifest_path": "/mnt/agent-code-authorship/survival-study/sourcegraph-longitudinal-v3/probes/a16z__halmos.json",
      "probe_status": "pending_sourcegraph",
      "probe_unit_id": "4d5140f58a2a3ca93332329c0bcb3c89127ae31fefe58c590b6ec3adc7e58764",
      "repository": {
        "bundle_sha256": "550328ae1d5282c5a4ddd5af1d3f11bea3fb223d0c41152cd6778524c70a5eb4",
        "cache_path": "/mnt/agent-code-authorship/survival-study/repositories/a16z__halmos",
        "canonical_repository_id": "a16z/halmos",
        "cutoff_commit": "079bb4241d1b460baf986257d56ea86977d73451",
        "cutoff_tree": "ba8e4db110d6827163bd994e06ba53fec6f21adf",
        "sourcegraph_name": "github.com/sg-evals/a16z-halmos"
      },
      "transition_shard": {
        "path": "/mnt/agent-code-authorship/survival-study/lineage-v1/transitions/a16z__halmos.jsonl",
        "sha256": "2acc90ff40ecf22b0aed65a723855f6a58d59b82dec2a4e8999879dae209b76b"
      }
    },
    {
      "introduction_shard": {
        "path": "/mnt/agent-code-authorship/survival-study/cohort-shards-v1/aftership__clickhouse-sql-parser.jsonl",
        "sha256": "ee145ea97461d61c098752b29ccd4345d5c988779f9a631ecbe109c87fcca7ad"
      },
      "probe_manifest_path": "/mnt/agent-code-authorship/survival-study/sourcegraph-longitudinal-v3/probes/aftership__clickhouse-sql-parser.json",
      "probe_status": "pending_sourcegraph",
      "probe_unit_id": "8f43f7f675e893d7fd1c32580c17816f28b96d08bbc382b65d4b8d44add151d7",
      "repository": {
        "bundle_sha256": "a2daf88b06421b508a30b0e6e7296c0effe4e1883515541088ff6aa3fc19d658",
        "cache_path": "/mnt/agent-code-authorship/survival-study/repositories/aftership__clickhouse-sql-parser",
        "canonical_repository_id": "aftership/clickhouse-sql-parser",
        "cutoff_commit": "e4c6e11fcec9a7140ef53835fae0728b2f304a3c",
        "cutoff_tree": "17b38fbd24ffad2af961f00318b71cf37b4eb62a",
        "sourcegraph_name": "github.com/sg-evals/aftership-clickhouse-sql-parser"
      },
      "transition_shard": {
        "path": "/mnt/agent-code-authorship/survival-study/lineage-v1/transitions/aftership__clickhouse-sql-parser.jsonl",
        "sha256": "8b9389efcb21d71e161213ad49103c6133e03d325ad4640a624aa546ba608509"
      }
    },
    {
      "introduction_shard": {
        "path": "/mnt/agent-code-authorship/survival-study/cohort-shards-v1/airbytehq__airbyte.jsonl",
        "sha256": "2dccfd69a2742aa70832ff34a4a465ab874f0de70e9a69dabc10f87e8eb6ad1d"
      },
      "probe_manifest_path": "/mnt/agent-code-authorship/survival-study/sourcegraph-longitudinal-v3/probes/airbytehq__airbyte.json",
      "probe_status": "pending_sourcegraph",
      "probe_unit_id": "b823524b1ec156a592bedeb6af86ffc7fb0d2d9d778fd2066948c0bf6dbb24ef",
      "repository": {
        "bundle_sha256": "61f2468bfa9dc1b16d7dde274609ce2416d2b4a819c6e817ea6fc95061c651bc",
        "cache_path": "/mnt/agent-code-authorship/survival-study/repositories/airbytehq__airbyte",
        "canonical_repository_id": "airbytehq/airbyte",
        "cutoff_commit": "926797c471d8741f7da77b1f8ed9663e51abdf7a",
        "cutoff_tree": "85dcecd8964ab3a7339a94c7517ad18bec798c45",
        "sourcegraph_name": "github.com/sg-evals/airbytehq-airbyte"
      },
      "transition_shard": {
        "path": "/mnt/agent-code-authorship/survival-study/lineage-v1/transitions/airbytehq__airbyte.jsonl",
        "sha256": "858de68eb80594ec56fd4e78377efdd348837567f4cfa6144d9e0a355a069abc"
      }
    },
    {
      "introduction_shard": {
        "path": "/mnt/agent-code-authorship/survival-study/cohort-shards-v1/aldinokemal__go-whatsapp-web-multidevice.jsonl",
        "sha256": "dedc172b19f069fe0d07b7e063158b7203de252e2e7c939e2a56aec9767e8099"
      },
      "probe_manifest_path": "/mnt/agent-code-authorship/survival-study/sourcegraph-longitudinal-v3/probes/aldinokemal__go-whatsapp-web-multidevice.json",
      "probe_status": "pending_sourcegraph",
      "probe_unit_id": "4ab3213c2af10d5329a4bb5187d283446b637fa8f6f128f63f478d0bbe379ec2",
      "repository": {
        "bundle_sha256": "88ac877a22ae8bdb8725d6c42eeac1fbdf88e3527d22563876255fa70ba09b21",
        "cache_path": "/mnt/agent-code-authorship/survival-study/repositories/aldinokemal__go-whatsapp-web-multidevice",
        "canonical_repository_id": "aldinokemal/go-whatsapp-web-multidevice",
        "cutoff_commit": "ee9d05da08768d35384f823494d4ed0a1643eef5",
        "cutoff_tree": "e5808d2b1462c5a1cf864528d29820da4e19945c",
        "sourcegraph_name": "github.com/sg-evals/aldinokemal-go-whatsapp-web-multidevice"
      },
      "transition_shard": {
        "path": "/mnt/agent-code-authorship/survival-study/lineage-v1/transitions/aldinokemal__go-whatsapp-web-multidevice.jsonl",
        "sha256": "4f3dd057d598916612894537073ff45cac6270306e5f356cc06c5ad5b2cd3e53"
      }
    },
    {
      "introduction_shard": {
        "path": "/mnt/agent-code-authorship/survival-study/cohort-shards-v1/alexanderjeurissen__ranger_devicons.jsonl",
        "sha256": "db9a0fa6373e26eb7a472919c13b9b5985271caa67de7b2bfca582186ecaa096"
      },
      "probe_manifest_path": "/mnt/agent-code-authorship/survival-study/sourcegraph-longitudinal-v3/probes/alexanderjeurissen__ranger_devicons.json",
      "probe_status": "pending_sourcegraph",
      "probe_unit_id": "ea46ab33baf6fcdb56b1451aabf02295d65625ef19c350feada07ff4f76234ad",
      "repository": {
        "bundle_sha256": "e08468b84ef5655657adcb790d154e0a0e2a4cbf6c0b82e520526ae8298c639f",
        "cache_path": "/mnt/agent-code-authorship/survival-study/repositories/alexanderjeurissen__ranger_devicons",
        "canonical_repository_id": "alexanderjeurissen/ranger_devicons",
        "cutoff_commit": "1bcaff0366a9d345313dc5af14002cfdcddabb82",
        "cutoff_tree": "2ed3eee582c51ed989e54c7f0367ed8eac0fe3fc",
        "sourcegraph_name": "github.com/sg-evals/alexanderjeurissen-ranger_devicons"
      },
      "transition_shard": {
        "path": "/mnt/agent-code-authorship/survival-study/lineage-v1/transitions/alexanderjeurissen__ranger_devicons.jsonl",
        "sha256": "3530c5731401853bbecd568567c23347fd0f5d993a88a5abd3b46731a7c3ca47"
      }
    },
    {
      "introduction_shard": {
        "path": "/mnt/agent-code-authorship/survival-study/cohort-shards-v1/alirezamika__autoscraper.jsonl",
        "sha256": "6a6325f647df5e54cfc0409eecb720630f96143e5b4d05101de3a178458c507f"
      },
      "probe_manifest_path": "/mnt/agent-code-authorship/survival-study/sourcegraph-longitudinal-v3/probes/alirezamika__autoscraper.json",
      "probe_status": "pending_sourcegraph",